id,date,user_id,user_username,user_displayname,replycount,retweetcount,likecount,quotecount,viewcount,searched_keyword,cleaned_text,hashtag_text,year,month_year,sentiment
1860000000000000000,2024-11-19 08:45:48+07,91900000,DineshDSouza,Dinesh DSouza,16,70,329,2,101466,Election2024 NeverTrump until 2024-12-06 since 2024-10-01,.TheNatPulse Editor wupton discusses the future of the Never Trump movement.,,2024,2024-11,Neutral
1860000000000000000,2024-11-19 08:50:52+07,1600000000000000000,Comed_Ai_n,BAIJ,0,0,0,0,59,Trump2024Victory until 2024-12-30 since 2024-10-01,Democrats Declare WW3 The Ultimate Plan to Stop Trump! Democrats Start WW3 to Stop Trumps Triumph! Pol Political Madness Laughs at Armageddon,"Trump2024Victory, DemocratsStartWW3, NuclearApocalypsePolitics, NewsomUndergroundPresident, SatiricalDemocracy, T",2024,2024-11,Negative
1860000000000000000,2024-11-19 09:07:48+07,169000000,cozharz,Coz Snyder,1,0,1,1,123,PresidentialElection2024 until 2024-12-30 since 2024-10-01,"Donald Trump secures a second term as President of the United States, winning 4 out of 7 swing states and leading in the remaining 3.","TrumpIsUnfitForOffice, Gaetz, MattGaetz, PeteHegseth, kristinoem, RFKJr, RobertKennedyJr, ElonMusk, PresidentialElection2024, Vance, JDVance, WashingtonDC",2024,2024-11,Positive
1860000000000000000,2024-11-19 10:15:04+07,695000000000000000,octothorpe_dr,Dr Octothorpe,0,1,1,0,69,TrumpIsMyPresident until 2024-12-30 since 2024-10-01,"Haha jokes on them. Face it, he won three times.",TrumpIsMyPresident,2024,2024-11,Positive
1860000000000000000,2024-11-19 19:14:02+07,1380000000,edgalvatronpari,ED GALVATRON PARIS,1,11,41,0,1320,Election2024 Trump KamalaHarris until 2024-12-06 since 2024-10-20,SHE SAID WHAT ABOUT TRUMP VOTERS?,"trump, election2024, disney, rant, rachelzegler, kamalaharris",2024,2024-11,Negative
1856215236224921706,2024-11-12 12:59:33+07,1608009748468871168,2025DJT2025,2025TRUMPS BLONDE2025,17,138,246,1,8682,TrumpIsMyPresident LoveTrump  until 2025-04-20 since  2024-12-06,"The Left BETTER NOT try anything on January 20th, 2025 PTrump",,2024,2024-11,0
1860000000000000000,2024-11-19 20:22:32+07,112000000,brithume,Brit Hume,678,1216,6227,134,375575,NeverTrump StopTrump until 2024-12-30 since 2024-10-01,"Quote The NeverTrump movement had no guiding principle other than 'Orange Man Bad.' They were a collection of powerhungry individuals, frustrated at being shut out of the Republican administration or denied access to the halls of power...",,2024,2024-11,Negative
1860000000000000000,2024-11-19 21:15:22+07,117000000,newtodagame,Newtodagame,0,0,1,0,59,TrumpIsDangerous until 2024-12-30 since 2024-10-01,Oh look this RACIST POS thinks this is funny! Lets laugh at his ignorance stupidity and white supremacy! A washed up mediocre white man who has nothing without his racist felon father.,"MAGAcultMoron, TrumpIsAConvictedFelon, TrumpIsDangerous, BlackWomenLead",2024,2024-11,Negative
1860000000000000000,2024-11-19 22:07:49+07,50800000,IngrahamAngle,Laura Ingraham,84,159,1076,5,43934,NeverTrump StopTrump until 2024-12-30 since 2024-10-01,"They predicted the end of Trump and MAGA, but now The end of NeverTrump The Spectator World",,2024,2024-11,Neutral
1860000000000000000,2024-11-19 23:56:51+07,1790000000000000000,trumprealparody,Donald J Trump  Parody,7035,336,1287,233,137399,DumpTrump NotMyPresident  until 2024-12-30 since 2024-10-01,BREAKING Whoopi Goldberg says I would like every Republican out there to stop referring to this man Trump as the president.He is not the president! Whats your response to Goldberg?,,2024,2024-11,Negative
1860000000000000000,2024-11-19 23:56:51+07,1790000000000000000,trumprealparody,Donald J Trump  Parody,7036,336,1287,233,137398,ResistTrump NotMyPresident​ until 2024-12-06 since 2024-10-01,BREAKING Whoopi Goldberg says I would like every Republican out there to stop referring to this man Trump as the president.He is not the president! Whats your response to Goldberg?,,2024,2024-11,Negative
1860000000000000000,2024-11-20 00:13:57+07,17400000,RONewCouncilEnt,ROKusWorld,3,1,6,0,62,NotMyPresident until 2024-12-06 since 2024-10-01​,"I percent Agree with this post, do you? rgpatnode LoveDemocraC tazalaz Bupattaya171832 CWittrodt HemmingsenAnita ResisterChic JeSuisFaith gmpullano grounded68 Gigiof333 Catmandoodlebug CoOfStrangers jenniferjcline jensdad4biden mommytlc",NotMyPresident,2024,2024-11,Neutral
1860000000000000000,2024-11-20 03:55:02+07,1140000000000000000,USA_Polling,Polling USA,86,425,6231,45,297594,USA2024 USAElection2024 Election2024 until 2025-3-31 since 2024-07-01,Economic unease Republicans win the Presidency Implement tariffs Economy tanks more Democrats sweep next election Pics unreleated,,2024,2024-11,Negative
1860000000000000000,2024-11-20 04:14:23+07,707000000,dogcatlover911,Savannah,0,2,1,0,36,TrumpForPrison until 2024-12-30 since 2024-10-01,Thats right! Trump was already prosecuted found guilty by a jury of 12. He was not a sitting President! Sentencing will take place after Trump serves his Presidency. Then he will be SENTENCED! This case is not going away! Trump is not above the law!,trumpforprison,2024,2024-11,Negative
1860000000000000000,2024-11-20 04:17:26+07,707000000,dogcatlover911,Savannah,1,0,0,1,97,TrumpForPrison until 2024-12-30 since 2024-10-01,Trump is Guilty as charged! Donald J Trump Is NOT ABOVE THE LAW!,trumpforprison,2024,2024-11,Negative
1860000000000000000,2024-11-21 01:06:23+07,2200000000,CSMLuisGonzalez,Luis Gonzalez,0,0,0,0,38,Trump2024 TrumpWon until 2024-12-30 since 2024-10-01,I can't get enough of these liberal meltdowns....,"LiberalMeltdown, LiberalismIsTheRealVirus, Trump2024, TrumpWon",2024,2024-11,Negative
1860000000000000000,2024-11-21 01:59:47+07,557000000,consciencevegan,Leslie D,8,13,16,1,2328,ResistTrump NotMyPresident​ until 2024-12-06 since 2024-10-01,"So this is where we are in this shit hole called America? No respect, intelligence, morals, decency, humanity? This is America...","ResistTrump, Resist, notmypresident, NotMyKing, NotMyGreedyKing, TrumpCheated, Recount2024, TrumpIsGoingDown, trumpisderangedandunhinged",2024,2024-11,Negative
1860000000000000000,2024-11-21 20:04:54+07,56800000,vanessadenha,Epiphany Communications Coach Vanessa,1,0,2,0,525,PresidentialElection2024 until 2024-12-30 since 2024-10-01,"Donald Trump Wins US Presidency For Second Time, World Leaders Including PM Modi Congratulate Him","10Commandments, presidentialelection2024",2024,2024-11,Neutral
1860000000000000000,2024-11-21 22:50:19+07,51200000,taradublinrocks,Tara Dublin Rock Star Author,6,21,52,0,998,TrumpIsAWarCriminal until 2024-12-30 since 2024-10-01,"So guardian isn't posting here anymore, but I'm happy to share this wonderful news about the ICC's warrant for war criminal Netanyahu's arrest NOW DO TRUMP, IntlCrimCourt",TrumpIsAWarCriminal,2024,2024-11,Positive
1860000000000000000,2024-11-21 23:33:38+07,1310000000000000000,TheOnlyEsta,Esta,239,359,927,17,11182,DumpTrump NotMyPresident  until 2024-12-30 since 2024-10-01,"Welp.. This is YOUR president, not mine Whos with me?",,2024,2024-11,Negative
1860000000000000000,2024-11-22 00:54:36+07,1830000000000000000,RGVetGaming,RG  Vet Gaming,0,0,0,0,6,Trump2024Victory until 2024-12-30 since 2024-10-01,Shoutout to TexasLindsay for bringing the news,"Trump, Trump2024Victory",2024,2024-11,Positive
1860000000000000000,2024-11-22 02:47:17+07,878000000,OccupyDemocrats,Occupy Democrats,49,199,504,7,13838,NeverTrump StopTrump until 2024-12-30 since 2024-10-01,YES! Hit the repost America! Lets spread the good news like wildfire! Follow us occupydemocrats Call to action,"thefightcontinues, sharethis, trumpisguilty, trump, stoptrump, trump2024, nevertrump, mattgaetz",2024,2024-11,Positive
1860000000000000000,2024-11-22 05:31:12+07,43700000,n_two,50501 fiftyfiftyone,2,1,5,1,874,TrumpForPrison until 2024-12-30 since 2024-10-01,Pray for Trump 's victims to get justice. All the women that he's assaulted. All the people he stepped over to climb the ladder All the families he separated. All the people that died cause of his shitty laws. All the minorities that're harmed with his approval,trumpforprison,2024,2024-11,Negative
1860000000000000000,2024-11-22 09:18:05+07,1280000000,drksmedia,Truth Social Media,0,0,4,0,337,Trump2024Victory until 2024-12-30 since 2024-10-01,"From sports to politics and even weddings in China, Trump's signature dance moves continue to trend worldwide!","TrumpDance, Trump2024Victory",2024,2024-11,Positive
1860000000000000000,2024-11-22 23:19:50+07,1250000000000000000,PraiseJesus617,Follow Christ,0,0,0,0,103,ResistTrump NotMyPresident​ until 2024-12-06 since 2024-10-01,So powerful. We truly owe it all to colored women,"ResistTrump, notmypresident",2024,2024-11,Positive
1860000000000000000,2024-11-22 23:19:50+07,1250000000000000000,PraiseJesus617,Follow Christ,0,0,0,0,103,NotMyPresident until 2024-12-06 since 2024-10-01​,So powerful. We truly owe it all to colored women,"ResistTrump, notmypresident",2024,2024-11,Positive
1860000000000000000,2024-11-22 23:41:47+07,2530000000,tv3_ghana,TV3GH,19,61,950,2,26794,YourVoteMatters ElectionNews until 2024-12-06 since 2024-10-20,How you voted on 21112024,"TV3GH, ElectionCommandCentre",2024,2024-11,Neutral
1860000000000000000,2024-11-23 19:20:32+07,395000000,Dream_Reborn,Elijah Jones,0,0,0,0,71,StopTrump until 2024-12-06 since 2024-10-20,"Is America going to eat US up and relieve US of our humanity, or will we be able to harness America towards humane purposes and human good?",StopTrump,2024,2024-11,Negative
1860000000000000000,2024-11-23 21:44:16+07,2530000000,tv3_ghana,TV3GH,11,15,250,2,12025,YourVoteMatters ElectionNews until 2024-12-06 since 2024-10-20,How you voted on 22112024,"TV3GH, ElectionCommandCentre",2024,2024-11,Neutral
1860000000000000000,2024-11-23 22:12:11+07,1540000000000000000,LissieWyatt,lissie,1,1,1,1,53,StopTrump until 2024-12-06 since 2024-10-20,Surprised?ANYONE?Fucking Nazis and Dictator Trump.,"HappyPutin, STOPTRUMP, elonputinTrumpFuckYouFascistNazis, AmericansAgainstTrumpsHeritageProject2025",2024,2024-11,Negative
1860000000000000000,2024-11-24 00:55:40+07,1320000000000000000,TheUnitedSpot__,The United Spot,39,334,969,19,26966,ImpeachTrump TrumpIndicted until 2024-12-30 since 2024-10-01,This Just In Trump has been indicted for ripping a tag off a mattress in 2016,,2024,2024-11,Negative
1860000000000000000,2024-11-24 03:09:54+07,1320000000000000000,TheUnitedSpot__,The United Spot,22,308,910,16,60827,TrumpIndicted ElectionNews until 2024-12-30 since 2024-10-01,Trump has been indicted for NOT being on DiddyEpstein client list.,,2024,2024-11,Negative
1860000000000000000,2024-11-24 03:27:10+07,1320000000000000000,TheUnitedSpot__,The United Spot,15,257,603,23,22516,ImpeachTrump TrumpIndicted until 2024-12-30 since 2024-10-01,Trump has been indicted for not cooperating with an active shooter and using time travel technology to avoid an attempted assassination.,,2024,2024-11,Negative
1860000000000000000,2024-11-24 09:56:32+07,1520000000000000000,Skriptkeeper17,SkriptkeeperElect,23,70,249,5,4448,TrumpStrong TrumpForever until 2024-12-30 since 2024-10-01,"I love when President realDonaldTrump said Never Give Up, Never Surrender!!! Fight Fight Fight!!!! This is myself JOKAQARMY1 song Fight",,2024,2024-11,Positive
1860000000000000000,2024-11-24 19:03:38+07,1380000000,edgalvatronpari,ED GALVATRON PARIS,1,9,49,0,905,Election2024 Trump KamalaHarris until 2024-12-06 since 2024-10-20,FULL WHAT YOU THINK?,"Trump, Conservative, America, Politics, Election2024, Joebiden, KamalaHarris, Democrats, Republican, Rants",2024,2024-11,Neutral
1860000000000000000,2024-11-24 20:24:13+07,2900000000,CristinaBuzasu,Cristina Buzasu,1,1,12,0,1747,PresidentialElection2024 until 2024-12-30 since 2024-10-01,Impact of Muslim votes in US presidential election Rachel Hamdoun reports from New York. by PressTV,"vote, romania, PresidentialElection2024",2024,2024-11,Neutral
1860000000000000000,2024-11-24 23:42:30+07,800000000000000000,LinnieElle,linnie ell,0,0,1,0,53,StopTrump until 2024-12-06 since 2024-10-20,Here's something to think about and spread around. Trump wants to get rid of the free press. He's a tyrant and the fucking Rs will let him do it.,"Resist, StopTrump, DemsUnited, FuckTrump",2024,2024-11,Negative
1860000000000000000,2024-11-25 19:57:58+07,1800000000000000000,WilliamAlbrech,ULTRAMAGA FANS TRUMP2028,157,95,199,8,5521,TrumpTrain Trump2024 until 2024-12-30 since 2024-10-01,MONDAY TRAIN LET'S GROW TOGETHER DROP YOUR HANDLES CONNECT WITH OTHER PATRIOTS REPOST THIS TWEET FOR MORE FOLLOWERS UNITY IS STRENGTH GOD BLESS AMERICA MAGA MAHA UNITE NOW TO SAVE AMERICA,"PatriotsUnite, VoteForTrump",2024,2024-11,Positive
1860000000000000000,2024-11-26 00:22:14+07,116000000,Taylor041993,Taylor James Edgar,0,1,4,0,691,NotMyPresident until 2024-12-06 since 2024-10-01​,Still supporting Dillon's Rolling Western.,"dillonsrollingwestern, dillon4smash, whoisemio, BENDYMOVIE, kingdomhearts, pokemonmasters, xenobladechroniclesx, notmypresident, switch2, stupidtrump, elonsucks, backyardsports, echoesofwisdom, digimon, dictatortrump, starfox",2024,2024-11,Positive
1860000000000000000,2024-11-26 01:41:25+07,1210000000000000000,TheLeoTerrell,LeoTerrell,107,423,2518,13,36810,TrumpIndicted FuckTrump until 2025-03-30 since 2024-09-01,"Every case brought against President Trump was motivated solely because he ran for President! Now those who were responsible will pay a heavy price effective January 20, 2025!",,2024,2024-11,Negative
1860000000000000000,2024-11-26 22:03:01+07,161000000,989word,989 WORD,0,0,2,0,106,Trump2024 Trump2024Election until 2024-12-30 since 2024-10-01,The LawFare is NOT OVER for Trump,"Trump2024, MakeAmericaGreatAgain, Trump4MoreYears, MAGA2024, AmericaFirst, TrumpPence2024, FourMoreYears, TrumpTrain, KeepAmericaGreat, Trump2024Election",2024,2024-11,Negative
1860000000000000000,2024-11-26 23:46:57+07,1520000000000000000,USA2224,UNITED STATES OF AMERICA,2,35,55,2,1821,Trump2024Victory until 2024-12-30 since 2024-10-01,TRUMP Remember what I used to say we're going to win so much!,Trump2024Victory,2024,2024-11,Neutral
1860000000000000000,2024-11-27 00:00:48+07,878000000,OccupyDemocrats,Occupy Democrats,264,879,1823,34,24654,NotMyPresident until 2024-12-06 since 2024-10-01​,WOW! Hit the and retweet if you agree that Trump and his team are ALL corrupt! Poptivism Follow us occupydemocrats Call to action,"thefightcontinues, share, trump, trumpisguilty, notmypresident, nevertrump, trump2024",2024,2024-11,Negative
1860000000000000000,2024-11-27 00:00:48+07,878000000,OccupyDemocrats,Occupy Democrats,264,879,1822,34,24654,NotMyPresident until 2024-12-06 since 2024-10-01​,WOW! Hit the and retweet if you agree that Trump and his team are ALL corrupt! Poptivism Follow us occupydemocrats Call to action,"thefightcontinues, share, trump, trumpisguilty, notmypresident, nevertrump, trump2024",2024,2024-11,Negative
1860000000000000000,2024-11-27 03:29:19+07,1750000000000000000,lindasun555,,0,8,16,0,137,TrumpIsMyPresident until 2024-12-30 since 2024-10-01,"In the Bible, Matthew 71314 says, Enter through the narrow gate for the gate is wide and the way is broad that leads to destruction, and there are many who enter through it.","TrumpIsMyPresident, CloseTheBorder, Illegalimmigration, StopTheCartels, WhereAreTheChildren",2024,2024-11,Neutral
1860000000000000000,2024-11-27 19:42:18+07,1320000000000000000,moonman_outloud,Far Right Fun Nut,0,0,1,0,17,TrumpDerangementSyndrome until 2024-12-30 since 2024-10-01,Trump may have broke Mark Hamill.,TrumpDerangementSyndrome,2024,2024-11,Negative
1860000000000000000,2024-11-28 00:04:49+07,1790000000000000000,trumprealparody,Donald J Trump  Parody,2932,133,538,75,50559,DumpTrump NotMyPresident  until 2024-12-30 since 2024-10-01,Whoopi Goldberg says I would like every Republican out there to stop referring to this man Trump as the president.He is not the president! Whats your response to Goldberg?,,2024,2024-11,Negative
1860000000000000000,2024-11-28 21:00:01+07,527000000,EricAbbenante,Eric Abbenante,246,115,717,38,133329,PoliticalAwareness AmericanPresident until 2024-12-06 since 2024-10-20,"Washington Post opinion columnist claiming America suffers from an 'epidemic of ignorance' Jen Rubin He is the president of the ignorant. Democrats have to work on making them less ignorant. Democrats 'Am I so out of touch? No, it's the voters who are wrong!'",,2024,2024-11,Negative
1860000000000000000,2024-11-28 21:04:24+07,987000000000000000,GeorgiaNeary,Georgia Neary,0,0,0,0,37,TrumpWon2024 until 2024-12-30 since 2024-10-01,Happy Thanksgiving! So thankful Trump is back and may our future be bright Time to celebrate Trump 4547,"Trump, Trump2024, Trump2024Vance, TrumpWon, Trump45, Trump47, TrumpWON2024, TrumpVance2024ToSaveAmerica, MAGA, GodBlessAmerica, USA, MAGA24, MAHA",2024,2024-11,Positive
1860000000000000000,2024-11-29 07:50:42+07,1730000000000000000,_jonathan_ahern,Jonathan Ahern,0,0,0,0,112,PresidentialElection2024 until 2024-12-30 since 2024-10-01,Fresh News Trump's Victory A Divided Thanksgiving,"Thanksgiving, presidentialelection2024",2024,2024-11,Negative
1860000000000000000,2024-11-29 10:10:59+07,58100000,BKLYNGurl7,Wanderluster,31,128,354,6,7358,RemoveTrump TrumpIsDangerous until 2024-12-30 since 2024-10-01,"If Trump is in danger ... it's because of his own rhetoric. He is his own worst enemy. There's not a person, a place or a thing that he doesn't demean, degrade, dehumanize, destroy, divide, use, abuse, threaten or bully. He's a wannabe mobsterdicktator. But he's just a coward",,2024,2024-11,Negative
1860000000000000000,2024-11-29 20:15:05+07,1800000000000000000,WilliamAlbrech,ULTRAMAGA FANS TRUMP2028,232,160,363,13,8218,TrumpTrain Trump2024 until 2024-12-30 since 2024-10-01,FRIDAY TRAIN LET'S GROW TOGETHER DROP YOUR HANDLES CONNECT WITH OTHER PATRIOTS REPOST THIS TWEET FOR MORE FOLLOWERS UNITY IS STRENGTH GOD BLESS AMERICA MAGA MAHA UNITE NOW TO SAVE AMERICA,"PatriotsUnite, VoteForTrump",2024,2024-11,Positive
1860000000000000000,2024-11-29 22:15:00+07,936000000000000000,RealAmVoice,Real Americas Voice RAV,26,90,481,3,45205,PoliticalAwareness AmericanPresident until 2024-12-06 since 2024-10-20,I THINK PRESIDENT TRUMP IS SO MUCH WISER THIS TIME AROUND. cogmf nataliegwinters,,2024,2024-11,Positive
1860000000000000000,2024-11-30 02:20:31+07,1670000000000000000,SD73660,Sandy,8,31,70,4,7108,TrumpDerangementSyndrome until 2024-12-30 since 2024-10-01,"Meathead Rob Reiner Meltdown, Deletes His Social Media Following Trumps Victory","TrumpDerangementSyndrome, TDS, Trump47, Hollywood, RobReiner",2024,2024-11,Negative
1860000000000000000,2024-11-30 12:34:37+07,39700000,lucialpage,LP,0,0,1,0,218,FuckTrump until 2024-12-06 since 2024-10-20,Even my vegetarian thanksgiving dinner looks better,"FuckTrump, FuckLeonMusk",2024,2024-11,Positive
1860000000000000000,2024-11-30 20:39:36+07,1780000000000000000,Carlex115185,Carlex Blue dot in a red state,0,1,1,0,50,FuckTrump until 2024-12-06 since 2024-10-20,This was the first time around w this pile of shit.Who the phuck thinks it will be any better this time around. tRumps plans only include lining his pockets n destroying our economy n democracy n fuck his,"FuckTrump, MAGACultMorons",2024,2024-11,Negative
1860000000000000000,2024-12-01 00:54:06+07,548000000,AntGmen,AntGmen,0,0,1,0,43,TrumpIsMyPresident until 2024-12-30 since 2024-10-01,She is a walking talking POS..,TRUMPISMYPRESIDENT,2024,2024-11,Negative
1860000000000000000,2024-12-01 08:34:51+07,1750000000000000000,MelaniaTrumpo,MELANIA TRUMP  PARODY,2745,125,548,49,43788,ResistTrump NotMyPresident​ until 2024-12-06 since 2024-10-01,Whoopi Goldberg says I would like every Republican out there to stop referring to this man Trump as the president.He is not the president! Whats your response to Goldberg?,,2024,2024-12,Negative
1860000000000000000,2024-12-01 13:33:41+07,159000000,defloody,David Floody Implosion Press,0,0,0,0,8,TrumpCrimeFamily until 2024-12-30 since 2024-10-01,YUP! Now in control. And as director of FBI!? Can it get any worse for American Democracy and Freedom. I'm guessing YES.,"TrumpCrimeFamily, KashPatel",2024,2024-12,Negative
1860000000000000000,2024-12-01 14:37:38+07,426000000,randiekay94,Miranda Renteria,0,0,0,0,44,FuckTrump until 2024-12-06 since 2024-10-20,I joined back when it was still twitter and I was using it to chronicle my post wisdom teeth surgery. Now look where we are. Bashing Trump and thristing over SeanSchemmel and other crap.,"seanschemmel, fucktrump, nevergrowingup, MyXAnniversary",2024,2024-12,Negative
1860000000000000000,2024-12-01 18:20:23+07,2950000000,mtribue28,Leo,1,2,1,0,147,TrumpForPrison until 2024-12-30 since 2024-10-01,News On The You Guys Are Not Going To Like This.,"StudentLoanForgiveness, College, Degree, StudentLoanDebts, TrumpCheated, SMH, TrumpIsGoingDown, TrumpIsUnfitForOffice, TrumpForPrison, TrumpIsGuilty, TrumpIsANationalSecurityRisk, JimJones, DonaldTrump, WorstPresidentInHistory",2024,2024-12,Negative
1860000000000000000,2024-12-01 22:54:59+07,1380000000,edgalvatronpari,ED GALVATRON PARIS,1,12,35,1,815,Election2024 Trump KamalaHarris until 2024-12-06 since 2024-10-20,SUSIE WILES CHIEF OF STAFF FOR DONALD TRUMP? WHAT YOU THINK?,"Trump, Conservative, America, Politics, Election2024, Joebiden, KamalaHarris, Democrats, Republican, Rants",2024,2024-12,Neutral
1860000000000000000,2024-12-02 07:19:17+07,1340000000000000000,1776Diva,,26,188,321,5,11496,PoliticalAwareness AmericanPresident until 2024-12-06 since 2024-10-20,"Im clear eyed about President Putin is, but the same can be said about how he views the wreckless actions of JoeBiden. We call on him as Americans to be patient and rational while we wait for the Trump administration.",,2024,2024-12,Negative
1860000000000000000,2024-12-02 07:47:51+07,1210000000000000000,Dianne50689540,Thoughts  Prayers,17,73,881,0,26884,FuckTrump until 2024-12-06 since 2024-10-20,RpsAgainstTrump OMG for real. Fcking awesome man love this,FUCKTRUMP,2024,2024-12,Positive
1860000000000000000,2024-12-02 08:57:47+07,2430000000,SPBMcKenna,True Blue,3,27,58,2,949,FuckTrump until 2024-12-06 since 2024-10-20,Just heard Trumps response to Hunter's pardon!,FuckTrump,2024,2024-12,Neutral
1860000000000000000,2024-12-02 17:31:26+07,138000000,VABVOX,Victoria Brownworth,194,649,1808,16,24656,ImpeachTrump TrumpIndicted until 2024-12-30 since 2024-10-01,"And just for the effing record, since y'all are in a tizzy over the Hunter Biden pardon, Trump was also impeached twice once for abuse of power and once for trying to overturn our government and sunder our Constitution. And Trump is a convicted felon and adjudicated rapist.",,2024,2024-12,Negative
1860000000000000000,2024-12-02 22:26:29+07,1170000000,pvtjokerus,john jackson,1249,20838,101927,594,2358764,ImpeachTrump TrumpIndicted until 2024-12-30 since 2024-10-01,Want your head to explode? Trump was impeached for trying to investigate all the crimes that Joe Biden just pardoned Hunter over.,,2024,2024-12,Negative
1860000000000000000,2024-12-02 23:04:24+07,2530000000,tv3_ghana,TV3GH,6,10,231,1,8612,YourVoteMatters ElectionNews until 2024-12-06 since 2024-10-20,Confusion erupts in Ayawaso Central after a voter allegedly takes a photo of ballot paper.,"TV3GH, ElectionCommandCentre",2024,2024-12,Negative
1860000000000000000,2024-12-02 23:32:20+07,1380000000,edgalvatronpari,ED GALVATRON PARIS,3,11,48,0,1262,Election2024 Trump KamalaHarris until 2024-12-06 since 2024-10-20,JOE BIDEN PARTON HUNTER BIDEN? WHAT YOU THINK?,"Trump, Conservative, America, Politics, Election2024, Joebiden, KamalaHarris, Democrats, Republican, Rants",2024,2024-12,Neutral
1860000000000000000,2024-12-03 00:44:53+07,1330000000000000000,patriottvnet,PatriotTVNetwork,0,0,0,0,158,2024Election until 2024-12-30 since 2024-10-01,Arrests Made as Threats Against Trump Escalate,"MarkSchaftlein, AngieWong, TheSchaftleinReport, TrumpThreats, 2024Election, HarrisCampaignFailures, MediaCollapse, ElectoralCollege, JDVance, KeithKellogg, MSNBC, CNNRatings, BidenApprovalRatings",2024,2024-12,Negative
1860000000000000000,2024-12-03 02:46:40+07,230000000,NYCgirl_InFL,BXBella,0,0,0,0,86,TrumpCrimeFamily until 2024-12-30 since 2024-10-01,"Today is November 2nd, 2024 Trump aka Fat Nixon is still a racist misogynistic pathological lying sociopath POS! F him, his brainless followers his weird ass looking family!",TrumpCrimeFamily,2024,2024-12,Negative
1860000000000000000,2024-12-03 03:33:58+07,1550000000000000000,namwella1961,LA Blue Dot in GA,777,6502,14111,211,195165,TrumpCrimeFamily until 2024-12-30 since 2024-10-01,Trump got 146 million to play golf Ivanka Jared got 640 million as WH advisors Ivanka got 41 Chinese trademarks Jared got 2 billion from the Saudis Don Jr. Eric stole from charities But tell us more about Hunter Biden's pardon.,"ProudBlue, TrumpCrimeFamily, TrumpIsUnfit",2024,2024-12,Negative
1860000000000000000,2024-12-03 05:42:11+07,1320000000000000000,mike4evolution,Michael Sami EN,0,2,2,0,105,FuckTrump until 2024-12-06 since 2024-10-20,"and For real, what can he do more than what Biden has done already? That narcissistic freak only talks big talk, more than he can actually deliver. Trump is way overrated, just like every other stupid POTUS.","FuckTrump, FuckUSA, USAisOverrated, USAisThePast",2024,2024-12,Negative
1860000000000000000,2024-12-03 10:00:00+07,1330000000000000000,patriottvnet,PatriotTVNetwork,0,0,1,0,168,2024Election until 2024-12-30 since 2024-10-01,Trump Cabinet Nominees Violently Targeted,"WillJohnson, RightOnFocus, TrumpCabinet, BombThreats, SwattingAttacks, PoliticalViolence, 2024Election, InaugurationThreats, NationalSecurity, PoliticalUnrest, TrumpAdministration",2024,2024-12,Negative
