id,date,user_id,user_username,user_displayname,replycount,retweetcount,likecount,quotecount,viewcount,searched_keyword,cleaned_text,hashtag_text,year,month_year,sentiment
1850000000000000000,2024-11-05 19:45:58+07,28900000,Phil_The_Aggie,Mr Phil,6,87,230,2,8095,ElectionDay Vote4Trump VoteRed until 2025-02-28 since 2024-07-01,"Today is the day! If you havent yet, get out and vote no matter how long it takes. Keep your eyes peeled for polling place shenanigans. And pray the election goes for President Trump. It is time to fix Americaits once again time to Make America Great Again!",,2024,2024-11,Positive
1850000000000000000,2024-11-05 19:49:02+07,817000000000000000,Chicago1Ray,Chicago1Ray,54,431,1549,7,13423,ElectionDay Vote4Trump VoteRed until 2025-02-28 since 2024-07-01,"WE'RE HERE FOLKS Election Day 2024 To everyone of you who has stood in line for hours to attend his rallies who supported, posted, donated, campaigned, prayed, voted for, and is voting for Donald J Trump to be the 47th President of these United States, Thank you",,2024,2024-11,Positive
1850000000000000000,2024-11-05 20:10:59+07,819000000000000000,JoJoFromJerz,Jo,3748,3784,28267,181,698751,Votefor2024 DonalTrump KamalaHarris AmericaDecides until 2025-03-30 since 2024-10-20,"Election Day is here. Dignity is on the ballot. Decency is on the ballot. Democracy is on the ballot. Today is the last day to decide. Who we are and who we want to be. I voted for Kamala two days ago. Its time for everyone who hasnt yet, to Lets win this.",VoteForKamalaToday,2024,2024-11,Positive
1850000000000000000,2024-11-05 20:24:09+07,1550000000000000000,namwella1961,LA Blue Dot in GA,62,521,1649,25,43924,Election2024 Trump HateTrump until 2024-12-06 since 2024-10-20,"It's time to say goodbye to Trump's Adderall fueled lies, hate, incitement of violence, stolen election claims, war on women, and hostile takeover attempt of America. FU Trump Today is the day","ProudBlue, TooBigTooRig, HarrisWalz2024InALandslide, VoteBlueDownBallot, VoteKamala",2024,2024-11,Negative
1850000000000000000,2024-11-05 20:24:09+07,1550000000000000000,namwella1961,LA Blue Dot in GA,62,520,1650,25,43928,GodBlessAmerica VoteHarrisWalz2024 VoteHarrisWalz election VoteBlue2024 until 2025-02-28 since 2024-07-01,"It's time to say goodbye to Trump's Adderall fueled lies, hate, incitement of violence, stolen election claims, war on women, and hostile takeover attempt of America. FU Trump Today is the day","ProudBlue, TooBigTooRig, HarrisWalz2024InALandslide, VoteBlueDownBallot, VoteKamala",2024,2024-11,Negative
1850000000000000000,2024-11-05 20:24:09+07,1550000000000000000,namwella1961,LA Blue Dot in GA,62,521,1648,25,43926,HandsOffProtests StopTrump2024 AntiTrump until 2024-12-30 since 2024-10-01Trumpsucks VoteTrumpOut TrumpIsNotMyPresident until 2024-12-30 since 2024-10-01,"It's time to say goodbye to Trump's Adderall fueled lies, hate, incitement of violence, stolen election claims, war on women, and hostile takeover attempt of America. FU Trump Today is the day","ProudBlue, TooBigTooRig, HarrisWalz2024InALandslide, VoteBlueDownBallot, VoteKamala",2024,2024-11,Negative
1850000000000000000,2024-11-05 20:29:15+07,99900000,Daminous_Purity,C Mervyn Graham,1,0,0,0,304,2024USPresidentialElection until 2024-12-30 since 2024-10-01,"It's ElectionDay, get your ass out of bed, off the couch, get in line and VoteTrump to fix America. Vote down the ballot and tell in one voice FCK YOU!","ElectionDay, VoteTrump, Republicans, Democrats, Trump2024, TeamUnity, 2024USELECTIONS, 2024uspresidentialelection, Election2024, ElectionDay",2024,2024-11,Negative
1850000000000000000,2024-11-05 20:36:49+07,1720000000000000000,SenseiBR_btc,Sensei,16,95,785,4,15198,NoMoreTrump Election2024 until 2024-12-30 since 2024-10-01,BIG BREAKING TRUMP WINNING US ELECTIONS FINAL 2024 election forecast Trump 312 Harris 226,NEW,2024,2024-11,Positive
1850000000000000000,2024-11-05 20:36:49+07,1720000000000000000,SenseiBR_btc,Sensei,16,98,785,4,15195,Election2024 Trump HateTrump until 2024-12-06 since 2024-10-20,BIG BREAKING TRUMP WINNING US ELECTIONS FINAL 2024 election forecast Trump 312 Harris 226,NEW,2024,2024-11,Positive
1850000000000000000,2024-11-05 20:36:49+07,1720000000000000000,SenseiBR_btc,Sensei,16,97,785,4,15195,Election2024 Trump HateTrump until 2024-12-06 since 2024-10-20,BIG BREAKING TRUMP WINNING US ELECTIONS FINAL 2024 election forecast Trump 312 Harris 226,NEW,2024,2024-11,Positive
1850000000000000000,2024-11-05 20:36:49+07,1720000000000000000,SenseiBR_btc,Sensei,16,97,785,4,15196,PresidentialElection2024 Trump  until 2024-12-06 since 2024-10-20,BIG BREAKING TRUMP WINNING US ELECTIONS FINAL 2024 election forecast Trump 312 Harris 226,NEW,2024,2024-11,Positive
1850000000000000000,2024-11-05 21:03:33+07,1300000000000000000,bitcoinlfgo,BITCOINLFG,164,906,6591,14,141953,DonaldJTrump  President2024 BREAKING POTUS DonaldTrump DonaldTrump2024 winner Election2024 electionday2024 until 2025-3-31 since 2024-07-01,BIG BREAKING DONALD TRUMP TO WIN IN A LAND SLIDE VICTORY,,2024,2024-11,Positive
1850000000000000000,2024-11-05 21:15:52+07,1260000000000000000,TheEXECUTlONER_,MRH,253,1441,5089,105,109132,ElectionDay Vote4Trump VoteRed until 2025-02-28 since 2024-07-01,Liliana from Rhode Island has a very special prayer for President Trump. How awesome is this? Today is the day. Go vote for President Trump. Our country is at stake. Help Make America Great Again. Make it Too Big to Rig.,"VotedForTrump, ElectionDay, Election2024",2024,2024-11,Positive
1850000000000000000,2024-11-05 21:19:56+07,1260000000000000000,TheEXECUTlONER_,MRH,40,536,927,15,21350,Trump2024NowMoreThenEver VoteVoteVote VoteTrump2024 until 2025-02-28 since 2024-07-01,Het out and vote! Go Vote for Trump! Keep this in mind,"Trump2024, Vote2024",2024,2024-11,Positive
1850000000000000000,2024-11-05 21:23:43+07,2240000000,ImKnotTheOne,Charli Huxley,169,326,2788,33,158104,VoteTrump VoteKamala ElectionDay Election2024 VotedforTrump until 2025-3-31 since 2024-07-01,Because only garbage people would vote for this garbage human. Cant wait for these people to crawl back under their rocks. Make America Great Again,"Trump2024, VotedforTrump, ElectionDay",2024,2024-11,Negative
1850000000000000000,2024-11-05 21:23:43+07,2240000000,ImKnotTheOne,Charli Huxley,169,326,2788,33,158104,ElectionDay Vote4Trump VoteRed until 2025-02-28 since 2024-07-01,Because only garbage people would vote for this garbage human. Cant wait for these people to crawl back under their rocks. Make America Great Again,"Trump2024, VotedforTrump, ElectionDay",2024,2024-11,Negative
1850000000000000000,2024-11-05 21:26:57+07,1740000000000000000,M1k3_TB,Mike,0,0,0,0,74,VoteTrump2024 until 2024-12-30 since 2024-10-01,Oh. So it was all a photo op Gotcha Sound ON,"Trump2024, Vote, VoteTrump2024",2024,2024-11,Negative
1850000000000000000,2024-11-05 21:30:00+07,1310000000000000000,voteheaux,DESERT EAGLE SUPREMACY,5,95,327,7,4577,VoteForAmerica Vote VoteBlue VoteHarris VoteKamala until 2025-02-28 since 2024-07-01,"Its time America. Get up, get out,","VOTEHEAUX, FireTheGOP, FireTheENTIREGOP, HarrisWalz2024, BlueDownBallot, EndThisAgentOrangeNightmare",2024,2024-11,Positive
1850000000000000000,2024-11-05 21:30:00+07,1310000000000000000,voteheaux,DESERT EAGLE SUPREMACY,5,95,327,7,4576,HandsOffProtests StopTrump2024 AntiTrump until 2024-12-30 since 2024-10-01Trumpsucks VoteTrumpOut TrumpIsNotMyPresident until 2024-12-30 since 2024-10-01,"Its time America. Get up, get out,","VOTEHEAUX, FireTheGOP, FireTheENTIREGOP, HarrisWalz2024, BlueDownBallot, EndThisAgentOrangeNightmare",2024,2024-11,Negative
1850000000000000000,2024-11-05 21:30:39+07,1490000000000000000,NowPammsy,PammsyNow,10,129,239,2,6331,TrumpStrong TrumpForever until 2024-12-30 since 2024-10-01,"How does he do it?? 2 AM and hes still goingTrump is like the Eveready battery! He keeps going going. He never stops fighting! Go out Vote fight for him like he does for you, America",,2024,2024-11,Positive
1850000000000000000,2024-11-05 21:36:00+07,1640000000,mmpadellan,BrooklynDadDefiant,128,480,1756,13,56599,Votefor2024 DonalTrump KamalaHarris AmericaDecides until 2024-12-06 since 2024-10-20,"What a stark difference between the positive hopefulness of the Harris campaign and the ugly, dark hatred of the trump campaign. That's why I decided to JOIN US. WE'RE COUNTING ON YOU.",VoteForKamalaToday,2024,2024-11,Positive
1850000000000000000,2024-11-05 21:41:42+07,1580000000000000000,SpartaJustice,Truth Justice,154,1072,6101,43,477786,USElection2024 ElonMusk2024 Election2024 ElectionDay until 2025-02-28 since 2024-07-01,"realDonaldTrump THE FUTURE OF AMERICA Go out and vote, vote like your life depends on it, vote like your future depends on it, because it does. This is the last chance man. elonmusk",,2024,2024-11,Positive
1850000000000000000,2024-11-05 21:41:46+07,1570000000000000000,Denise10231976,Denise,41,170,584,9,10231,FuckTrump DumpTrump until 2024-12-06 since 2024-10-01,"FU Trump, get away from our country and take your fan club with you",,2024,2024-11,Negative
1850000000000000000,2024-11-05 22:00:34+07,1580000000000000000,Destiny15_FL,Destiny,12,120,232,2,5178,Election2024 Trump 2024 VoteForTrump VoteTrump until 2024-11-6 since 2024-6-15,LFG ELECTION DAY IS HERE GET TO THE POLLS AND VOTE TO REELECT DONALD J. TRUMP,"Trump2024, Election2024, ElectionDay",2024,2024-11,Positive
1850000000000000000,2024-11-05 22:05:15+07,184000000,jakharpardeep,pardeep jakhar,30,154,426,6,32815,USA2024 USAElection2024 Election2024 until 2025-3-31 since 2024-07-01,United State Elections. Who is the Next president Retweet for Trump Like for Trump,"ElectionDay, Vote2024, USElection2024",2024,2024-11,Neutral
1850000000000000000,2024-11-05 22:07:06+07,4730000000,jjacobchacon,Jacob Chacn,17,74,251,3,3497,TrumpTrain Trump2024 until 2024-12-30 since 2024-10-01,The TPAction TRUMP TRAIN has arrived here in south Scottsdale We will be buzzing voters to polling sites with shorter line times!,,2024,2024-11,Positive
1850000000000000000,2024-11-05 22:08:33+07,1430000000000000000,Sassafrass_84,Sassafrass84,22,170,508,7,6842,Election2024 Trump 2024 VoteForTrump VoteTrump until 2024-11-6 since 2024-6-15,Today is the day. Don't sit this one out. Go vote! Let's take our country back. Trump is loved worldwide. Fight for Trump.,,2024,2024-11,Positive
1850000000000000000,2024-11-05 22:08:33+07,1430000000000000000,Sassafrass_84,Sassafrass84,22,170,509,7,6842,Election2024 Trump 2024 VoteForTrump VoteTrump until 2024-11-6 since 2024-6-15,Today is the day. Don't sit this one out. Go vote! Let's take our country back. Trump is loved worldwide. Fight for Trump.,,2024,2024-11,Positive
1850000000000000000,2024-11-05 22:08:33+07,1430000000000000000,Sassafrass_84,Sassafrass84,22,170,509,7,6842,Trump2024NowMoreThenEver VoteVoteVote VoteTrump2024 until 2025-02-28 since 2024-07-01,Today is the day. Don't sit this one out. Go vote! Let's take our country back. Trump is loved worldwide. Fight for Trump.,,2024,2024-11,Positive
1850000000000000000,2024-11-05 22:15:00+07,1130000000000000000,HotepsBnToldYou,HotepsBeenToldYou,9,69,246,6,11280,ImpeachTrump TrumpIndicted until 2024-12-30 since 2024-10-01,They indicted TRUMP. They shot TRUMP. They threw dirt on TRUMP'S name. Today is the day. RETURN OF THE KING,,2024,2024-11,Positive
1850000000000000000,2024-11-05 22:21:02+07,1290000000000000000,mccloskeyusa,Mark McCloskey,9,74,411,2,5561,election 2024 vote for american until 2024-12-19 since 2024-10-01,"NOW IS THE TIME! Get out and vote. All you hunters, bikers, preppers, evangelicals, all you who feel politics is too corrupt to participate in, vote for Trump today or our freedoms, including the right to be left alone, will be gone forever.",,2024,2024-11,Positive
1850000000000000000,2024-11-05 22:34:22+07,2640000000,ImSpeaking13,Kate,26,61,742,3,13848,FuckTrump DumpTrump until 2024-12-06 since 2024-10-01,Did the thing and Donald Trump can fuck all the way off.,,2024,2024-11,Negative
1850000000000000000,2024-11-05 22:39:26+07,47300000,w_terrence,Terrence K Williams,265,1252,6069,31,67609,VoteTrump VoteKamala ElectionDay Election2024 VotedforTrump until 2025-3-31 since 2024-07-01,TODAY IS THAT DAY Lets do this. Get up and go Vote! This is the most Important election. You cant sit this one out. Friendly Reminder Kamala had 4 years to do all the things shes promising to do! Vote for President Donald Trump!,"ElectionDay, electionday2024",2024,2024-11,Negative
1850000000000000000,2024-11-05 22:39:26+07,47300000,w_terrence,Terrence K Williams,265,1252,6069,31,67609,Votefor2024 DonalTrump KamalaHarris AmericaDecides until 2025-03-30 since 2024-10-20,TODAY IS THAT DAY Lets do this. Get up and go Vote! This is the most Important election. You cant sit this one out. Friendly Reminder Kamala had 4 years to do all the things shes promising to do! Vote for President Donald Trump!,"ElectionDay, electionday2024",2024,2024-11,Negative
1648285762314711040,2023-04-18 18:22:04+07,1142736007567069184,SUBRATA30016572,Trump Lover,65,163,687,8,14241,TrumpIsMyPresident LoveTrump  until 2025-04-20 since  2024-12-06,"Today is April 18th, 2023 and Trump still my President!!",,2023,2023-04,Positive
1850000000000000000,2024-11-05 22:39:26+07,47300000,w_terrence,Terrence K Williams,265,1260,6070,31,67609,Votefor2024 DonalTrump KamalaHarris AmericaDecides until 2024-12-06 since 2024-10-20,TODAY IS THAT DAY Lets do this. Get up and go Vote! This is the most Important election. You cant sit this one out. Friendly Reminder Kamala had 4 years to do all the things shes promising to do! Vote for President Donald Trump!,"ElectionDay, electionday2024",2024,2024-11,Negative
1850000000000000000,2024-11-05 22:45:25+07,50400000,LifeNewsHQ,LifeNewscom,21,41,251,2,6006,Election2024 TrumpNews PollAnalysis until 2024-12-30 since 2024-10-01,Trump is Leading in Enough States to Project Him Winning 287251,,2024,2024-11,Positive
1850000000000000000,2024-11-05 22:49:14+07,1700000000000000000,X1Waseem,Itx Waseem,2,2,40,0,10515,USElection2024 ElonMusk2024 Election2024 ElectionDay until 2025-02-28 since 2024-07-01,"At first, I thought it was a hoax but it's real Elon Musk has updated the like button for the U.S. Elections Retweet for Trump Like for Kamala","USElection2024, ElectionDay",2024,2024-11,Positive
1850000000000000000,2024-11-05 23:17:58+07,148000000,ArmaLite15OU812,LD Basler,7,196,481,1,8552,AmericanVoters​ Trump until 2024-12-30 since 2024-10-01,America is voting Donald Trump! Lets get this party started!!,,2024,2024-11,Positive
1850000000000000000,2024-11-05 23:17:58+07,148000000,ArmaLite15OU812,LD Basler,7,195,482,1,8552,election 2024 vote for american until 2024-12-19 since 2024-10-01,America is voting Donald Trump! Lets get this party started!!,,2024,2024-11,Positive
1850000000000000000,2024-11-05 23:30:18+07,808000000000000000,NadaAJones,Hope,89,26,444,6,14406,Election2024 Trump HateTrump until 2024-12-06 since 2024-10-20,Fuck you !! Ill support who I want .Go to hell !! Be smart and vote Trump 2024,,2024,2024-11,Negative
1850000000000000000,2024-11-05 23:43:29+07,1840000000000000000,america,America,174,564,2471,38,179717,election 2024 vote for american until 2024-12-19 since 2024-10-01,Get out and Vote today for Secure Borders Sensible Spending Safe Cities Fair Justice System Free Speech SelfProtection VOTE Trump,VOTE,2024,2024-11,Positive
1850000000000000000,2024-11-05 23:43:29+07,1840000000000000000,america,America,174,564,2468,38,179714,AmericanVoters​ Trump until 2024-12-30 since 2024-10-01,Get out and Vote today for Secure Borders Sensible Spending Safe Cities Fair Justice System Free Speech SelfProtection Trump,VOTE,2024,2024-11,Positive
1850000000000000000,2024-11-06 00:05:02+07,1660000000000000000,LisaFla8,LisaFLA8,0,0,6,0,93,NeverAgainTrump until 2024-12-06 since 2024-10-20,"Before The Toxic Trump Effectremember whomever won Ohio, won the presidency? Now we have this MAGA Moron chess game of 7 swing statesthanks to turning Red states Bluish, with his own ignorance and lies. TOO BIG TO RIG is a Joke MAGA is a Myth.","Fraud45, NeverAgainTrump",2024,2024-11,Negative
1850000000000000000,2024-11-06 00:16:15+07,892000000,ConservativeOG,Conservative,19,143,480,3,25606,TrumpStrong TrumpForever until 2024-12-30 since 2024-10-01,THROUGH JAIL. THROUGH LAWFARE. THROUGH SLANDER. THROUGH GUNFIRE. DONALD J. TRUMP IS STILL STANDING!,,2024,2024-11,Positive
1850000000000000000,2024-11-06 00:36:16+07,1430000000000000000,Sassafrass_84,Sassafrass84,38,270,1402,3,15222,ElectionDay Vote4Trump VoteRed until 2025-02-28 since 2024-07-01,Yes...it hit me last night. Whatever happens today on just know that President Trump put his life on the line for us. He took a bullet for America. We love him. The world loves him and supports him. Don't stay home. Go vote for 47. Let's Make America Great,ElectionDay,2024,2024-11,Positive
1850000000000000000,2024-11-06 00:40:42+07,120000000,CPAC,CPAC,15,56,503,5,1027985,PoliticalAwareness AmericanPresident until 2024-12-06 since 2024-10-20,"Since his first CPAC speech, realDonaldTrump has shown unwavering commitment to a vision of strength, resilience, opportunity for all Americans and CPAC has stood by his side. TODAY, lets make a difference GET OUT AND VOTE!! View the CPAC Voters Guide at",,2024,2024-11,Positive
1850000000000000000,2024-11-06 00:43:57+07,1500000000000000000,Aadhya__Sri,,31,62,225,1,43312,election 2024 vote for american until 2024-12-19 since 2024-10-01,"5th of November Election Day in America! Dear Americans GO VOTE For Trump Make him Mr President, Make America Great Again Vote For your country's safely, children better future and security!",,2024,2024-11,Positive
1850000000000000000,2024-11-06 00:43:57+07,1500000000000000000,Aadhya__Sri,,31,62,225,1,43311,PresidentialElection VoteUSA Vote Trump unil 2024-11-06 since 2024-05-01,"5th of November Election Day in America! Dear Americans GO VOTE For Trump Make him Mr President, Make America Great Again Vote For your country's safely, children better future and security!",,2024,2024-11,Positive
1850000000000000000,2024-11-06 00:51:58+07,1520000000000000000,cat_barnes30,Catherine,31,154,729,5,38281,BanTrump Trump2024 until 2024-12-30 since 2024-10-01,The choice couldn't be clearer.,Trump2024TheOnlyChoice,2024,2024-11,Positive
1850000000000000000,2024-11-06 00:52:10+07,1780000000000000000,shubhamViral,Shubham Kumar,3,7,188,1,26288,USElection2024 ElonMusk2024 Election2024 ElectionDay until 2025-02-28 since 2024-07-01,Its happening! Elon Musk has updated the like button for Election Day Retweet for Kamala Like for Trump Whos getting your support?,"USElection2024, ElectionDay, electionday2024",2024,2024-11,Neutral
1850000000000000000,2024-11-06 01:00:32+07,47300000,w_terrence,Terrence K Williams,1396,7430,59518,127,570119,VoteRed VoteRepublican VoteTrump2024 until 2025-02-28 since 2024-07-01,I VOTED for Trump. I had no choice I really care about the future of this country and the American Dream. I come from poverty the foster care system but America gave me so many opportunities. I believe Donald Trump is the only candidate who will make it possible for,,2024,2024-11,Positive
1850000000000000000,2024-11-06 01:02:44+07,1390000000000000000,cb_doge,DogeDesigner,1307,4567,27833,189,2864879,USElection2024 ElonMusk2024 Election2024 ElectionDay until 2025-02-28 since 2024-07-01,This election is the most important election of our lifetime. This is no ordinary election. The other side wants to take away your freedom. President Trump must win to preserve the Constitution. He must win to preserve Democracy in America. Elon Musk,,2024,2024-11,Positive
1850000000000000000,2024-11-06 01:03:26+07,1780000000000000000,shubhamViral,Shubham Kumar,9,29,735,0,93708,USElection2024 ElonMusk2024 Election2024 ElectionDay until 2025-02-28 since 2024-07-01,Alert! Elon Musk has switched up the like button for Election Day Retweet for Kamala Like for Trump Whos getting your support?,"USElection2024, ElectionDay, electionday2024, Election2024",2024,2024-11,Neutral
1850000000000000000,2024-11-06 01:21:22+07,25100000,realDonaldTrump,Donald J Trump,57048,75927,614515,4963,42001059,Trump2024NowMoreThenEver VoteVoteVote VoteTrump2024 until 2025-02-28 since 2024-07-01,Your vote will lead us to Greatness. Your vote will unleash a new GOLDEN AGE! Your vote will MAKE AMERICA GREAT AGAIN! GREATER THAN EVER BEFORE! VOTE TRUMP!,"VotedForTrump, Election2024",2024,2024-11,Positive
1850000000000000000,2024-11-06 01:21:22+07,25100000,realDonaldTrump,Donald J Trump,57062,75897,613884,4963,41999310,Election2024 Trump 2024 VoteForTrump VoteTrump until 2024-11-6 since 2024-6-15,Your vote will lead us to Greatness. Your vote will unleash a new GOLDEN AGE! Your vote will MAKE AMERICA GREAT AGAIN! GREATER THAN EVER BEFORE! VOTE TRUMP!,"VotedForTrump, Election2024",2024,2024-11,Positive
1850000000000000000,2024-11-06 01:21:22+07,25100000,realDonaldTrump,Donald J Trump,57048,75912,614468,4963,42000857,Election2024 Trump 2024 VoteForTrump VoteTrump until 2024-11-6 since 2024-6-15,Your vote will lead us to Greatness. Your vote will unleash a new GOLDEN AGE! Your vote will MAKE AMERICA GREAT AGAIN! GREATER THAN EVER BEFORE! VOTE TRUMP!,"VotedForTrump, Election2024",2024,2024-11,Positive
1850000000000000000,2024-11-06 01:32:00+07,7590000,SkyNews,Sky News,128,70,467,19,136217,PresidentialElection VoteUSA unil 2024-12-30 since 2024-10-01,It looks like we have a very substantial lead. Republican presidential candidate Donald Trump speaks to the media as he arrives to vote in Florida. US election latest,,2024,2024-11,Positive
1850000000000000000,2024-11-06 01:49:47+07,1820000000000000000,MAGACult2,MAGA Cult Slayer,1281,1682,10464,117,283395,Votefor2024 DonalTrump KamalaHarris AmericaDecides until 2024-12-06 since 2024-10-20,I just voted. I chose family. I chose women. I chose America!,"Vote, VoteForKamala, USDemocracy, TryNotToCry",2024,2024-11,Positive
1850000000000000000,2024-11-06 02:01:20+07,1630000000000000000,Agback_Savage,SilverbackSavage,1,1,2,0,125,PatriotsForTrump until 2024-12-30 since 2024-10-01,"I may not have the 2024 flag, but Im reppin.","MAGA2024, KeepAmericaGreat, PatriotsForTrump, TrumpTrain, Trump2024, SaveAmerica, PatriotPride, AmericaFirst, BackTheRedWhiteBlue, ConservativeVoices",2024,2024-11,Neutral
1850000000000000000,2024-11-06 02:11:42+07,4100000000,The_Trump_Train,The Trump Train,38,312,968,8,27756,TrumpTrain Trump2024 until 2024-12-30 since 2024-10-01,"PATRIOTS, HOLD THE LINE AND CONTINUE TO VOTE TRUMP! DONT LET THE DEMOCRATS STEAL YOUR GOD GIVEN RIGHTS!",ElectionDay,2024,2024-11,Negative
1850000000000000000,2024-11-06 02:17:21+07,455000000,galacticaactual,MAGA Marie,22,443,1496,14,29568,TrumpTrain Trump2024 until 2024-12-30 since 2024-10-01,"Trump Train, AlaskaStyle!! Alaska For Trump!","Trump2024, MAGA",2024,2024-11,Positive
1850000000000000000,2024-11-06 02:29:36+07,1810000000000000000,poorlydrawn911,poorly drawn 911,11,241,1352,4,33588,GodBlessAmerica VoteHarrisWalz2024 VoteHarrisWalz election VoteBlue2024 until 2025-02-28 since 2024-07-01,"popping back on here to urge you to this election is not only critical to protecting our welfare, but also to preserving the rights of all marginalized communities within the nation. as a first time voter, i am so proud to have casted my ballot for","VOTE, HarrisWalz",2024,2024-11,Positive
1850000000000000000,2024-11-06 02:52:41+07,1780000000000000000,Anshika_in,Anshika Singh Yadav,81,397,1504,8,31067,VoteTrump VoteKamala ElectionDay Election2024 VotedforTrump until 2025-3-31 since 2024-07-01,Swing state's tilt is completely in favor of Donald Trump Therefore it is almost certain that the next President of America will be Donald Trump Elon Musk has a very big role to play if Trump becomes president,"VoteTrump, VoteKamala, ElectionDay, Election2024, VotedforTrump",2024,2024-11,Positive
1850000000000000000,2024-11-06 03:00:07+07,1240000000000000000,amerikanstrong,Central Intelligence Agentry,0,0,0,0,292,NoToTrump until 2024-12-30 since 2024-10-01,Our long national nightmare is about to end. Vote!,"TrumpIsGoingDown, HarrisWalz2024InALandslide, VoteMagaOut, TrumpIsAConvictedFelon, MAGAInsanity, NoToTrump",2024,2024-11,Positive
1850000000000000000,2024-11-06 03:07:53+07,62100000,Jazziette,,0,0,2,0,94,MakeAmericaGreatAgain2024 until 2024-12-30 since 2024-10-01,"President Donald Trump told a crowd at a rally in Aurora, Colorado that he would round up all the illegal aliens and deport every single one.",MakeAmericaGreatAgain2024,2024,2024-11,Negative
1850000000000000000,2024-11-06 03:09:49+07,1840000000000000000,america,America,160,646,2949,14,143482,election 2024 vote for american until 2024-12-19 since 2024-10-01,Get in line and stay in line. Your vote could help determine the destiny of America and the fate of western civilization. Lets win this,,2024,2024-11,Positive
1850000000000000000,2024-11-06 03:34:51+07,1610000000000000000,LibertyLee33,Lee,2,21,72,0,3810,TrumpForPresident2024 until 2024-12-30 since 2024-10-01,"Hold the line, you got this! Godspeed patriots!",TrumpForPresident2024,2024,2024-11,Positive
1850000000000000000,2024-11-06 03:42:59+07,110000000,EliseStefanik,Elise Stefanik,23,98,463,2,20167,ElectionDay Vote4Trump VoteRed until 2025-02-28 since 2024-07-01,Today is the day we Let's bring it home. Go vote for President Donald J. Trump!,"SaveAmerica, FightForAmerica, VotedForTrump, ElectionDay",2024,2024-11,Positive
1850000000000000000,2024-11-06 03:55:49+07,1820000000000000000,_ajtsanchez,AJ,3267,6954,71976,304,1370403,AmericanVoters​ Trump until 2024-12-30 since 2024-10-01,"As a never Trumper last election, I just voted against my best interest for President Donald Trump. Its time we put AMERICA FIRST again!",,2024,2024-11,Positive
